{
  "schemaVersion": 1,
  "messageId": "0195f3c2-7d1e-7a4b-9c11-2b6f0e5a8d36",
  "gatewayId": "gw-emulator-01",
  "type": "DEVICE_DISCOVERED",
  "sentAt": "2026-09-25T10:14:05.000Z",
  "bootId": "0195f3b8-0a2b-7c3d-9e4f-a1b2c3d4e5f6",
  "seq": 3,
  "payload": {
    "deviceId": "sensor-hall-05",
    "deviceType": "TEMPERATURE",
    "capabilities": [{ "metric": "temperature", "unit": "CEL" }],
    "metadata": { "firmware": "v1.2.0-rc", "busAddress": "0x48" }
  },
  "signature": null
}
