{
  "schemaVersion": 1,
  "messageId": "0195f3c2-7d1e-7a4b-9c11-2b6f0e5a8d35",
  "gatewayId": "gw-emulator-01",
  "type": "SECURITY_EVENT",
  "sentAt": "2026-09-25T10:15:30.500Z",
  "bootId": "0195f3b8-0a2b-7c3d-9e4f-a1b2c3d4e5f6",
  "seq": 10424,
  "payload": {
    "deviceId": "sensor-fridge-01",
    "severity": "CRITICAL",
    "code": "PHYSICAL_ANOMALY",
    "message": "Температура -500.0 °C вне физически допустимого диапазона",
    "detectedAt": "2026-09-25T10:15:30.000Z",
    "detector": { "name": "ids", "version": "0.3.1" },
    "details": { "metric": "temperature", "value": -500.0 }
  },
  "signature": null
}
