{
  "schemaVersion": 1,
  "messageId": "0195f3c2-7d1e-7a4b-9c11-2b6f0e5a8d34",
  "gatewayId": "gw-emulator-01",
  "type": "TELEMETRY",
  "sentAt": "2026-09-25T10:15:30.120Z",
  "bootId": "0195f3b8-0a2b-7c3d-9e4f-a1b2c3d4e5f6",
  "seq": 10423,
  "payload": {
    "samples": [
      {
        "deviceId": "sensor-fridge-01",
        "ts": "2026-09-25T10:15:29.500Z",
        "metrics": { "temperature": 4.2, "humidity": 41.0 }
      },
      {
        "deviceId": "sensor-hall-02",
        "ts": "2026-09-25T10:15:29.900Z",
        "metrics": { "temperature": 21.7, "co2_ppm": 640 }
      }
    ]
  },
  "signature": null
}
